{
  "schema_version": 1,
  "project": "Project-Context-System",
  "state_doc": "docs/PROJECT_STATE.md",
  "active_work_doc": "docs/ACTIVE_WORK.md",
  "architecture_doc": "docs/ARCHITECTURE.md",
  "roadmap_doc": "docs/ROADMAP.md",
  "adr_dir": "docs/ADR",
  "incidents_dir": "docs/INCIDENTS",
  "evidence_doc": "docs/EVIDENCE.md",
  "state_based_on_commit": "b87c63ae20ed70b6834c6f0fd65494521dfcd4e3",
  "last_verified_commit": "b87c63ae20ed70b6834c6f0fd65494521dfcd4e3",
  "active_branch": "feat/pcs-v1-foundation",
  "active_pr": 1,
  "status": "review",
  "updated_at": "2026-08-21"
}
